{
  "schema": "aidlc.intent-ref/v1",
  "id": "init-does-not-invalidate-the-prefix",
  "source": {
    "provider": "git",
    "locator": ".aidlc/artifacts/intent/init-does-not-invalidate-the-prefix.md",
    "revision": "5d46e11",
    "authority": "git"
  },
  "decision": {
    "status": "accepted",
    "decided_by": "cwijayasundara",
    "decided_at": "2026-09-02T06:13:06.119Z"
  },
  "snapshot_digest": "sha256:e4445d4a8160c613464ed8814bcafaf5b956dbf8a98207705ccdc45a5b91695b"
}
