{
  "schema": "aidlc.intent-ref/v1",
  "id": "the-suite-total-is-ratcheted",
  "source": {
    "provider": "git",
    "locator": ".aidlc/artifacts/intent/the-suite-total-is-ratcheted.md",
    "revision": "61997a2",
    "authority": "git"
  },
  "decision": {
    "status": "accepted",
    "decided_by": "cwijayasundara",
    "decided_at": "2026-09-03T05:43:10.740Z"
  },
  "snapshot_digest": "sha256:0a91a3a8b0895851fcc3364b6ce57cccc6fd54f1c5e2e0cc973a59bcd432bcad"
}
