{
  "schema": "aidlc.intent-ref/v1",
  "id": "a-draft-governs-only-its-own-files",
  "source": {
    "provider": "git",
    "locator": ".aidlc/artifacts/intent/a-draft-governs-only-its-own-files.md",
    "revision": "4d63601",
    "authority": "git"
  },
  "decision": {
    "status": "accepted",
    "decided_by": "cwijayasundara",
    "decided_at": "2026-09-02T13:45:23.009Z"
  },
  "snapshot_digest": "sha256:aa2c2fc541f7eea88fce3a2037c4359565f9991f8e609cc09fe20f378a8f8c58"
}
