{
  "schema": "aidlc.intent-ref/v1",
  "id": "the-ledger-cannot-judge-a-deterrent",
  "source": {
    "provider": "git",
    "locator": ".aidlc/artifacts/intent/the-ledger-cannot-judge-a-deterrent.md",
    "revision": "2589f9a",
    "authority": "git"
  },
  "decision": {
    "status": "accepted",
    "decided_by": "cwijayasundara",
    "decided_at": "2026-09-03T03:44:56.550Z"
  },
  "snapshot_digest": "sha256:270924132627463e153df399b7410304a701d99038f4d3886775a4659d6940cf"
}
