{
  "schema": "aidlc.intent-ref/v1",
  "id": "ci-is-green-without-a-key",
  "source": {
    "provider": "git",
    "locator": ".aidlc/artifacts/intent/ci-is-green-without-a-key.md",
    "revision": "6e3d28b",
    "authority": "git"
  },
  "decision": {
    "status": "accepted",
    "decided_by": "cwijayasundara",
    "decided_at": "2026-09-03T03:51:25.404Z"
  },
  "snapshot_digest": "sha256:c5f0e9b78aaa0b9c0c0e1b40d2e2e8529fb3edfbdacc41fdeab0e852a081cd97"
}
