{
  "schema": "aidlc.intent-ref/v1",
  "id": "require-contract-defaults-on",
  "source": {
    "provider": "git",
    "locator": ".aidlc/artifacts/intent/require-contract-defaults-on.md",
    "revision": "pending",
    "authority": "git"
  },
  "decision": {
    "status": "draft",
    "decided_by": null,
    "decided_at": null
  },
  "snapshot_digest": "pending"
}
