{
  "schema": "aidlc.intent-ref/v1",
  "id": "dormant-sensors-run-at-commit",
  "source": {
    "provider": "git",
    "locator": ".aidlc/artifacts/intent/dormant-sensors-run-at-commit.md",
    "revision": "666c14b",
    "authority": "git"
  },
  "decision": {
    "status": "accepted",
    "decided_by": "cwijayasundara",
    "decided_at": "2026-09-03T08:04:09.676Z"
  },
  "snapshot_digest": "sha256:0eff04be98fa25bf5b88613dc9e3c77ffb6efa5dc759cf86187c3c7c3d9ca355"
}
