{
  "schema": "aidlc.intent-ref/v1",
  "id": "force-is-not-the-agents-to-give",
  "source": {
    "provider": "git",
    "locator": ".aidlc/artifacts/intent/force-is-not-the-agents-to-give.md",
    "revision": "pending",
    "authority": "git"
  },
  "decision": {
    "status": "draft",
    "decided_by": null,
    "decided_at": null
  },
  "snapshot_digest": "pending"
}
